{
  "$schema": "../case-manifest.schema.json",
  "schema_version": "gmsh_fvcom_case_v1",
  "case_id": "san_francisco_bay",
  "display_name": "San Francisco Bay",
  "execution_order": 1,
  "experiment_status": "proposed",
  "domain_type": "coastal_open",
  "projected_crs": "EPSG:32610",
  "boundary": {
    "input_kind": "adaptive_v2",
    "resolution_manifest": "Workspace/Preprocessing/fvcom-grid-generation/runs/sf_precond_20260725T141352Z/upstream/bdry_arc_corrected/boundary_resolution/boundary_resolution_manifest.json",
    "model_boundary_loops_gpkg": "Workspace/Preprocessing/fvcom-grid-generation/runs/sf_precond_20260725T141352Z/upstream/bdry_arc_corrected/model_boundary_loops/model_boundary_loops.gpkg",
    "model_boundary_loop_manifest": "Workspace/Preprocessing/fvcom-grid-generation/runs/sf_precond_20260725T141352Z/upstream/bdry_arc_corrected/model_boundary_loops/model_boundary_loop_manifest.json",
    "expected_open_boundary_count": 1,
    "open_boundaries": [
      {
        "id": "pacific",
        "kind": "ocean_exchange",
        "cyclic": false,
        "orientation": "preserve_source_order"
      }
    ],
    "expected_island_holes": 11,
    "preserve_source_vertices": true,
    "allow_gmsh_boundary_insertion": true,
    "negative_rejection_fixtures": []
  },
  "bathymetry": {
    "netcdf": "Workspace/Preprocessing/fvcom-grid-generation/runs/sf_precond_20260725T141352Z/upstream/cudem_bathy/sf_precond_loop_coverage_retry_bathy_sources.nc",
    "source_policy": [
      "reuse_existing_full_footprint"
    ],
    "coverage_requirement": "finite positive depth over the complete accepted wet domain",
    "status": "available"
  },
  "context": {
    "archived_mesh_quality_json": "Workspace/Preprocessing/fvcom-grid-generation/runs/sf_precond_20260725T141352Z/mesh_quality.json",
    "comparison_policy": "metric_by_metric_no_composite_winner"
  },
  "budget": {
    "preflight_node_threshold": 4500000,
    "hard_node_cap": 5000000,
    "hu_increment_m": 25,
    "overflow_reruns": 1
  },
  "sizing": {
    "mode": "obc_distance_threshold",
    "near_obc_size_m": 8000,
    "near_obc_distance_m": 10000,
    "far_obc_distance_m": 70000,
    "bathymetry_floor_multiplier": 3,
    "bathymetry_floor_roundup_m": 25
  },
  "preparation": [
    "Revalidate the corrected adaptive-v2 manifest and its input hashes.",
    "Verify that all 11 resolved island loops remain holes."
  ],
  "readiness": {
    "status": "ready",
    "boundary_status": "available",
    "bathymetry_status": "available",
    "blockers": []
  },
  "notes": [
    "Archived in-house meshes are context only; do not rerun the in-house mesher."
  ]
}
